{"api_version":"1.0","data":{"client":{"id":"example-client","path":"/Users/example/Music/Mixes/Clients/Example Client"},"client_snapshot_path":"/Users/example/Music/Mixes/Clients/Example Client/Projects/Example Project/00_Admin/client-profile-snapshot.json","initial_revision_path":"/Users/example/Music/Mixes/Clients/Example Client/Projects/Example Project/04_Revisions/Revision_01","manifest_path":"/Users/example/Music/Mixes/Clients/Example Client/Projects/Example Project/00_Admin/project-manifest.json","project":{"artist":"Example Artist","id":"example-project","name":"Example Project","path":"/Users/example/Music/Mixes/Clients/Example Client/Projects/Example Project"},"workspace_path":"/Users/example/Music/Mixes"},"errors":[],"operation":"project.create","status":"success","warnings":[]}
